{
  "event": {
    "designation": "DrupalSouth",
    "location": "Sydney",
    "year": "2024",
    "website": "https://drupalsouth.org/events/drupalsouth-sydney-2024/schedule",
    "region": "Australia – Sydney",
    "endDate": "2024-03-22T04:00:00Z",
    "startDate": "2024-03-19T21:00:00Z",
    "venue": "Sydney Masonic Centre",
    "timezone": "Australia/Sydney",
    "enabled": true,
    "sourceCache": "cache/remote/2026-04-25T11-45-04Z/drupalsouth-sydney-2024-json-sydney-2024",
    "flickr": {
      "enabled": true,
      "groupUrl": "https://flic.kr/g/3gAEqd",
      "image": "./img/flickr/drupalsouth/2024-sydney.jpg",
      "imageAlt": "DrupalSouth logo"
    },
    "logo": {
      "image": "./img/logos/drupalsouth-logo.png",
      "imageAlt": "DrupalSouth logo",
      "usePlate": false
    },
    "sponsors": [
      {
        "id": "sponsor-1",
        "title": "Salsa DIgital",
        "tier": "Platinum",
        "row": 1,
        "priority": 1,
        "image": "./img/sponsors/drupalsouth/2024-sydney/sponsor-1.png",
        "imageAlt": "Salsa DIgital logo",
        "link": "https://drupalsouth.org/sponsors/salsa-digital",
        "bgStyle": "auto",
        "aspect": "auto",
        "enabled": true
      },
      {
        "id": "sponsor-2",
        "title": "Morpht",
        "tier": "Gold",
        "row": 2,
        "priority": 1,
        "image": "./img/sponsors/drupalsouth/2024-sydney/sponsor-2.png",
        "imageAlt": "Morpht logo",
        "link": "https://drupalsouth.org/sponsors/morpht",
        "bgStyle": "light-plate",
        "aspect": "auto",
        "enabled": true
      },
      {
        "id": "sponsor-3",
        "title": "amazee.io",
        "tier": "Gold",
        "row": 2,
        "priority": 2,
        "image": "./img/sponsors/drupalsouth/2024-sydney/sponsor-3.png",
        "imageAlt": "amazee.io logo",
        "link": "https://drupalsouth.org/sponsors/amazeeio",
        "bgStyle": "auto",
        "aspect": "auto",
        "enabled": true
      },
      {
        "id": "sponsor-4",
        "title": "platform.sh",
        "tier": "Gold",
        "row": 2,
        "priority": 3,
        "image": "./img/sponsors/drupalsouth/2024-sydney/sponsor-4.png",
        "imageAlt": "platform.sh logo",
        "link": "https://drupalsouth.org/sponsors/platformsh",
        "bgStyle": "light-plate",
        "aspect": "auto",
        "enabled": true
      },
      {
        "id": "sponsor-5",
        "title": "GovCMS",
        "tier": "Gold",
        "row": 2,
        "priority": 4,
        "image": "./img/sponsors/drupalsouth/2024-sydney/sponsor-5.jpg",
        "imageAlt": "GovCMS logo",
        "link": "https://drupalsouth.org/sponsors/govcms",
        "bgStyle": "light-plate",
        "aspect": "auto",
        "enabled": true
      },
      {
        "id": "sponsor-6",
        "title": "Oxide Interactive",
        "tier": "Silver",
        "row": 3,
        "priority": 1,
        "image": "./img/sponsors/drupalsouth/2024-sydney/sponsor-6.png",
        "imageAlt": "Oxide Interactive logo",
        "link": "https://drupalsouth.org/sponsors/oxide-interactive",
        "bgStyle": "auto",
        "aspect": "auto",
        "enabled": true
      },
      {
        "id": "sponsor-7",
        "title": "Skpr",
        "tier": "Silver",
        "row": 3,
        "priority": 2,
        "image": "./img/sponsors/drupalsouth/2024-sydney/sponsor-7.png",
        "imageAlt": "Skpr logo",
        "link": "https://drupalsouth.org/sponsors/skpr",
        "bgStyle": "light-plate",
        "aspect": "auto",
        "enabled": true
      },
      {
        "id": "sponsor-8",
        "title": "Free Sauce",
        "tier": "Silver",
        "row": 3,
        "priority": 3,
        "image": "./img/sponsors/drupalsouth/2024-sydney/sponsor-8.png",
        "imageAlt": "Free Sauce logo",
        "link": "https://drupalsouth.org/sponsors/free-sauce",
        "bgStyle": "auto",
        "aspect": "auto",
        "enabled": true
      },
      {
        "id": "sponsor-9",
        "title": "Annex",
        "tier": "Silver",
        "row": 3,
        "priority": 4,
        "image": "./img/sponsors/drupalsouth/2024-sydney/sponsor-9.png",
        "imageAlt": "Annex logo",
        "link": "https://drupalsouth.org/sponsors/annex",
        "bgStyle": "auto",
        "aspect": "auto",
        "enabled": true
      },
      {
        "id": "sponsor-10",
        "title": "Acquia",
        "tier": "Networking Function",
        "row": 4,
        "priority": 1,
        "image": "./img/sponsors/drupalsouth/2024-sydney/sponsor-10.png",
        "imageAlt": "Acquia logo",
        "link": "https://drupalsouth.org/sponsors/acquia",
        "bgStyle": "auto",
        "aspect": "auto",
        "enabled": true
      },
      {
        "id": "sponsor-11",
        "title": "Sparks Interactive",
        "tier": "Merchandise",
        "row": 5,
        "priority": 1,
        "image": "./img/sponsors/drupalsouth/2024-sydney/sponsor-11.png",
        "imageAlt": "Sparks Interactive logo",
        "link": "https://drupalsouth.org/sponsors/sparks-interactive",
        "bgStyle": "light-plate",
        "aspect": "auto",
        "enabled": true
      },
      {
        "id": "sponsor-12",
        "title": "PreviousNext",
        "tier": "Sprint",
        "row": 6,
        "priority": 1,
        "image": "./img/sponsors/drupalsouth/2024-sydney/sponsor-12.png",
        "imageAlt": "PreviousNext logo",
        "link": "https://drupalsouth.org/sponsors/previousnext",
        "bgStyle": "auto",
        "aspect": "auto",
        "enabled": true
      },
      {
        "id": "sponsor-13",
        "title": "Ironstar",
        "tier": "Splash Awards",
        "row": 7,
        "priority": 1,
        "image": "./img/sponsors/drupalsouth/2024-sydney/sponsor-13.png",
        "imageAlt": "Ironstar logo",
        "link": "https://drupalsouth.org/sponsors/ironstar",
        "bgStyle": "auto",
        "aspect": "auto",
        "enabled": true
      },
      {
        "id": "sponsor-14",
        "title": "Technocrat",
        "tier": "Coffee Cart",
        "row": 8,
        "priority": 1,
        "image": "./img/sponsors/drupalsouth/2024-sydney/sponsor-14.png",
        "imageAlt": "Technocrat logo",
        "link": "https://drupalsouth.org/sponsors/technocrat",
        "bgStyle": "auto",
        "aspect": "auto",
        "enabled": true
      },
      {
        "id": "sponsor-15",
        "title": "The Drop Times",
        "tier": "Media",
        "row": 9,
        "priority": 1,
        "image": "./img/sponsors/drupalsouth/2024-sydney/sponsor-15.png",
        "imageAlt": "The Drop Times logo",
        "link": "https://drupalsouth.org/sponsors/thedroptimes",
        "bgStyle": "light-plate",
        "aspect": "auto",
        "enabled": true
      },
      {
        "id": "sponsor-16",
        "title": "Drupalize Me",
        "tier": "Supporting",
        "row": 10,
        "priority": 1,
        "image": "./img/sponsors/drupalsouth/2024-sydney/sponsor-16.png",
        "imageAlt": "Drupalize Me logo",
        "link": "https://drupalsouth.org/sponsors/drupalizeme",
        "bgStyle": "auto",
        "aspect": "auto",
        "enabled": true
      }
    ],
    "columns": 3,
    "scheduleURLs": [
      "https://drupalsouth.org/events/drupalsouth-sydney-2024/schedule"
    ]
  },
  "items": [
    {
      "startTime": "2024-03-19T21:00:00Z",
      "endTime": "2024-03-19T22:00:00Z",
      "duration": "P60M",
      "title": "Registration / Tea & Coffee",
      "location": "Foyer",
      "link": "",
      "track": [
        "Other"
      ],
      "speakers": [],
      "full_description": "",
      "video_url": "",
      "sponsorIds": "sponsor-14"
    },
    {
      "startTime": "2024-03-19T22:00:00Z",
      "endTime": "2024-03-19T22:10:00Z",
      "duration": "P10M",
      "title": "Welcome to Country",
      "location": "Grand Lodge",
      "link": "",
      "track": [
        "Other"
      ],
      "speakers": [],
      "full_description": "",
      "video_url": "",
      "sponsorIds": ""
    },
    {
      "startTime": "2024-03-19T22:10:00Z",
      "endTime": "2024-03-19T22:20:00Z",
      "duration": "P10M",
      "title": "Welcome from the DrupalSouth Committee",
      "location": "Grand Lodge",
      "link": "",
      "track": [
        "Other"
      ],
      "speakers": [],
      "full_description": "",
      "video_url": "",
      "sponsorIds": ""
    },
    {
      "startTime": "2024-03-19T22:20:00Z",
      "endTime": "2024-03-19T23:05:00Z",
      "duration": "P45M",
      "title": "The Drupal Project Update",
      "location": "Grand Lodge",
      "link": "https://drupalsouth.org/events/drupalsouth-sydney-2024/schedule/3147",
      "track": [
        "Keynote"
      ],
      "speakers": [
        "Dries Buytaert"
      ],
      "full_description": "In this very special keynote kicking off DrupalSouth Sydney 2024, Dries will present an update on the project and the development of Drupal.\n\nIn case you didn't know, here's a little more about Dries and Drupal from his website:\n\n\"I'm the Founder of Drupal. Drupal is Open Source software for building websites and digital experiences. Currently, around 2% of all websites worldwide are built with Drupal. In the enterprise, that number is 1 out of 10 websites. Drupal is one of the largest and most active Open Source projects in the world. I've been working on Drupal for more than two decades, and continue to lead the project today as Drupal's Project Lead.\"",
      "video_url": "https://youtu.be/c5ctyfDDFxg",
      "sponsorIds": ""
    },
    {
      "startTime": "2024-03-19T23:05:00Z",
      "endTime": "2024-03-19T23:15:00Z",
      "duration": "P10M",
      "title": "Break",
      "location": "",
      "link": "",
      "track": [
        "Other"
      ],
      "speakers": [],
      "full_description": "",
      "video_url": "",
      "sponsorIds": ""
    },
    {
      "startTime": "2024-03-19T23:15:00Z",